video_url,user_url,username,title,view_num,created_at,shortdesc,collected_at
/watch?v=oJAbATJCugs&pp=ygUOZ2xvYmFsIHdhcm1pbmfSBwkJhwoBhyohjO8%3D,/@NatGeo,National Geographic,Global Warming 101 | National Geographic,5.7M,18 years,"Global warming could do more than just melt polar ice. It could change our maps, and displace people from cities and tropical ...",2026-01-21 08:44:41.173148
/watch?v=Y3gqoDUtmt4&pp=ygUOZ2xvYmFsIHdhcm1pbmc%3D,/@Peekaboo_Kidz,Peekaboo Kidz,Global Warming - The End Game | The Dr. Binocs Show | Best Learning Videos For Kids | Peekaboo Kidz,4.1M,6 years,What Is Global Warming? | The Dr. Binocs Show | Best Learning Videos For Kids | Peekaboo Kidz Hi KIDZ! Welcome to a BRAND ...,2026-01-21 08:44:41.174950
/watch?v=G4H1N_yXBiA&pp=ygUOZ2xvYmFsIHdhcm1pbmc%3D,/@NatGeo,National Geographic,Causes and Effects of Climate Change | National Geographic,5.8M,8 years,What causes climate change (also known as global warming)? And what are the effects of climate change? Learn the human ...,2026-01-21 08:44:41.177024
/watch?v=uynhvHZUOOo&pp=ygUOZ2xvYmFsIHdhcm1pbmc%3D,/@TheEconomist,The Economist,See what three degrees of global warming looks like,4.7M,4 years,"If global temperatures rise three degrees Celsius above pre-industrial levels, the results would be catastrophic. It's an entirely ...",2026-01-21 08:44:41.179945
/watch?v=2njn71TqkjA&pp=ygUOZ2xvYmFsIHdhcm1pbmc%3D,/@TEDEd,TED-Ed,What Earth in 2050 could look like - Shannon Odell,1.2M,1 year,What could our future world look like if we continue to do nothing about climate change? Take a look at the possibilities. -- While ...,2026-01-21 08:44:41.181107
/watch?v=G9t__9Tmwv4&pp=ygUOZ2xvYmFsIHdhcm1pbmc%3D,/@Scienceabc,Science ABC,Climate Change and Global Warming: Explained in Simple Words for Beginners,652K,3 years,The term climate change is used to denote the long-term changes in the weather patterns in a given region. Another term often ...,2026-01-21 08:44:41.185169
/watch?v=0F3QPY83NZQ&pp=ygUOZ2xvYmFsIHdhcm1pbmc%3D,/@NatGeo,National Geographic,Global Warming 101 | National Geographic,113K,14 years,"Global warming could do more than just melt polar ice. It could change our maps, and displace people from cities and tropical ...",2026-01-21 08:44:41.187983
/watch?v=h1jOqyjcO4g&pp=ygUOZ2xvYmFsIHdhcm1pbmc%3D,/@SimonClark,Simon Clark,How much progress have we made on climate change?,2.5M,10 months,"Progress is happening all over the world. I couldn't fit the entire world into my studio though, so built a model. See how I did that ...",2026-01-21 08:44:41.191463
/watch?v=LwRTw_7NNJs&pp=ygUOZ2xvYmFsIHdhcm1pbmc%3D,/@nasaclimatechange,ARHCIVED - NASA Climate Change,Global Warming from 1880 to 2022,338K,3 years,"Earth's average surface temperature in 2022 tied with 2015 as the fifth warmest on record, according to an analysis by NASA.",2026-01-21 08:44:41.195461
/watch?v=tRA2SfSk2Tc&pp=ygUOZ2xvYmFsIHdhcm1pbmc%3D,/@StarTalk,StarTalk,How I Think About Climate Change,2.2M,11 months,What does “climate change” mean? Neil deGrasse Tyson explains under-emphasized elements of climate change and humanity's ...,2026-01-21 08:44:41.197349
/watch?v=31SCn3bcTHc&pp=ygUOZ2xvYmFsIHdhcm1pbmc%3D,/@Peekaboo_Kidz,Peekaboo Kidz,Can We Stop Climate Change? | Global Warming | The Dr Binocs Show | Peekaboo Kidz,504K,3 years,Can We Stop Climate Change? | Heat Waves | Global Warming | Reasons For Climate Change | What Causes Climate Change?,2026-01-21 08:44:41.198915
/watch?v=PqxMzKLYrZ4&pp=ygUOZ2xvYmFsIHdhcm1pbmc%3D,/@AumSum,It's AumSum Time,Global Warming | #aumsum #kids #science #education #children,7.7M,10 years,Global Warming. The thicker layer of greenhouse gases traps more heat. This result in an increase in average temperature of the ...,2026-01-21 08:44:41.200649
/watch?v=lHFd5kLAwNY&pp=ygUOZ2xvYmFsIHdhcm1pbmc%3D,/@NatGeo,National Geographic,Global Warming 101 | National Geographic,189K,13 years,"Global warming could do more than just melt polar ice. It could change our maps, and displace people from cities and tropical ...",2026-01-21 08:44:41.204641
/watch?v=Vl6VhCAeEfQ&pp=ygUOZ2xvYmFsIHdhcm1pbmc%3D,/@TED,TED,The Tipping Points of Climate Change — and Where We Stand | Johan Rockström | TED,1.4M,1 year,"We're nearly halfway through the 2020s, dubbed the most decisive decade for action on climate change. Where exactly do things ...",2026-01-21 08:44:41.207359
/watch?v=pEt6-jA2UE4&pp=ygUOZ2xvYmFsIHdhcm1pbmc%3D,/@DWDocumentary,DW Documentary,Climate change - Averting catastrophe | DW Documentary,3M,2 years,"In the last 30 years, CO2 emissions have increased by 60 percent worldwide. The most pressing problem facing our civilization is ...",2026-01-21 08:44:41.210965
/watch?v=LxgMdjyw8uw&pp=ygUOZ2xvYmFsIHdhcm1pbmc%3D,/@kurzgesagt,Kurzgesagt – In a Nutshell,We WILL Fix Climate Change!,11M,3 years,Getting something from the kurzgesagt shop is the best way to support us and to keep our videos free for everyone.,2026-01-21 08:44:41.212023
/watch?v=F8vI5_gN90g&pp=ygUOZ2xvYmFsIHdhcm1pbmc%3D,/@aljazeeraenglish,Al Jazeera English,Inside the planet’s most urgent climate warning | Global Warning E1 | Featured Documentary,516K,3 months,"With global access, this three-part series examines the real consequences of climate change for our civilisation, through the rest of ...",2026-01-21 08:44:41.213229
/watch?v=ipVxxxqwBQw&pp=ygUOZ2xvYmFsIHdhcm1pbmc%3D,/@kurzgesagt,Kurzgesagt – In a Nutshell,Who Is Responsible For Climate Change? – Who Needs To Fix It?,11M,5 years,Sources & further reading: https://sites.google.com/view/sourcesclimateresponsibility/ Special thanks to the team at Our World for ...,2026-01-21 08:44:49.932913
/watch?v=UkhaC6Pc0ZM&pp=ygUOZ2xvYmFsIHdhcm1pbmc%3D,/@CuriosityStreaming,Curiosity Stream,The Environmental Effects of Climate Change On Our Planet | Breakthrough,120K,1 year,"Climate change is one of the most pressing issues facing our planet today, with impacts felt across every continent. Scientists are ...",2026-01-21 08:44:49.935298
/watch?v=iGkLcqLWxMA&pp=ygUOZ2xvYmFsIHdhcm1pbmc%3D,/@PBSNewsHour,PBS NewsHour,Earth is ‘perilously close’ to a global warming threshold. Here’s what to know,113K,10 months,"This past week, the EPA said it is reconsidering the scientific finding that greenhouse gases are a danger to public health.",2026-01-21 08:44:49.937681
/watch?v=YJrKgBUDGYc&pp=ygUOZ2xvYmFsIHdhcm1pbmc%3D,/@BBCWhatsNew,BBC What’s New / Actu Jeunes,What is Global Warming? - BBC What's New,56K,7 years,Global warming is a huge issue that affects every single one of us. Experts say it's extremely likely that human activity is the main ...,2026-01-21 08:44:49.939410
/watch?v=WGgDw9I9mr0&pp=ygUOZ2xvYmFsIHdhcm1pbmc%3D,/@60minutes,60 Minutes,Climate Change | 60 Minutes Marathon,1.5M,1 year,"From 2006, Scott Pelley's report on the evidence of Global Warming in the arctic. Also from 2006, Pelley's report on government ...",2026-01-21 08:44:49.942902
/watch?v=d7Ci_EooW-k&pp=ygUOZ2xvYmFsIHdhcm1pbmc%3D,/@Letstute,Let'stute,Greenhouse Effect and Global Warming | Environmental Science | LetsTute,2.1M,7 years,"Hello Friends! Check out our video on ""Greenhouse Effect and Global Warming” by Letstute. Greenhouse Effect and Global ...",2026-01-21 08:44:49.947222
/watch?v=N6t6QHQtdVw&pp=ygUOZ2xvYmFsIHdhcm1pbmc%3D,/@Peekaboo_Kidz,Peekaboo Kidz,Climate Change 101 | Keep The Environment Safe | The Dr Binocs Show | Peekaboo Kidz,2.8M,3 years,Climate | How To Keep The Environment Safe? | Global Warming | Climate Change | What Causes Global Warming?,2026-01-21 08:44:49.949929
/watch?v=Y1mPWVzaGQY&pp=ygUOZ2xvYmFsIHdhcm1pbmc%3D,/@crashcourse,CrashCourse,What is Climate Change?: Crash Course Biology #8,219K,2 years,Life on Earth has weathered boiling-hot oceans and volcanic-ash-darkened skies—but that's nothing like the climate change ...,2026-01-21 08:44:49.951894
/watch?v=dpvd9FensT8&pp=ygUOZ2xvYmFsIHdhcm1pbmfSBwkJhwoBhyohjO8%3D,/@astrumspace,Astrum,This Will Be My Most Disliked Video On YouTube,4M,2 years,"#climatechange #astrum #globalwarming climate change, global warming, Earths temperature, climate cycles, Foraminifera, ...",2026-01-21 08:44:49.953352
/watch?v=rqWzK_DehcY&pp=ygUOZ2xvYmFsIHdhcm1pbmfSBwkJhwoBhyohjO8%3D,/@Cognitoedu,Cognito,GCSE Biology - Global Warming | Greenhouse Effect Explained (2026/27 exams),18K,8 months,Check out our website https://www.cognito.org/ ⭐️ *** WHAT'S COVERED *** 1. The distinction between global warming and ...,2026-01-21 08:44:49.957517
/watch?v=GGtAilkWTtI&pp=ygUOZ2xvYmFsIHdhcm1pbmc%3D,/@SimonClark,Simon Clark,Global Warming: An Inconvenient History,1.2M,3 years,"This is the story of how we discovered the planet was warming, and why. Learn the building blocks of climate science with ...",2026-01-21 08:44:49.959612
/watch?v=PwgqVoFhVNM&pp=ygUOZ2xvYmFsIHdhcm1pbmc%3D,/@aljazeeraenglish,Al Jazeera English,Inside the planet’s race to adapt | Global Warning E2 | Featured Documentary,269K,3 months,"With global access, this three-part series examines the real consequences of climate change for our civilisation, through the rest of ...",2026-01-21 08:44:49.961116
/watch?v=6S2gPoQ8ROE&pp=ygUOZ2xvYmFsIHdhcm1pbmc%3D,/@ClimateAdam,ClimateAdam,Why Has Global Warming Just Spiked?,59K,8 months,Climate scientists weren't expecting 2023. The planet's temperature is increasing thanks to that whole burning fossil fuels thing.,2026-01-21 08:44:49.964189
/watch?v=nWPlf9ZpHBI&pp=ygUOZ2xvYmFsIHdhcm1pbmfSBwkJhwoBhyohjO8%3D,/@Toppscholars,Toppscholars,"Understand Global Warming & Climate Change | Greenhouse Effect | Causes, Effects, and Solutions",59K,2 years,"Understand Global Warming & Climate Change | Greenhouse Effect | Causes, Effects, and Solutions
| Greenhouse Effect and Global ...",2026-01-21 08:44:49.966762
/watch?v=4Uy9b87cYRs&pp=ygUOZ2xvYmFsIHdhcm1pbmc%3D,/@fuseschool,FuseSchool - Global Education,How Does Global Warming Effect The Environment | Environmental Chemistry | Chemistry | FuseSchool,115K,5 years,How Does Global Warming Effect The Environment? Learn the basics about the effect of global warming on the environment.,2026-01-21 08:44:49.968775
/watch?v=dIsjcG7hTmo&pp=ygUOZ2xvYmFsIHdhcm1pbmfSBwkJhwoBhyohjO8%3D,/@bbcearth,BBC Earth,When The World Gets 1℃ Hotter | Climate Change: The Facts | BBC Earth,487K,4 years,"From the moment we wake up to when we go to sleep we are all using energy, this emissions from this constant generation of ...",2026-01-21 08:44:49.969951
/watch?v=WkvPdUtYhX8&pp=ygUOZ2xvYmFsIHdhcm1pbmc%3D,/@LearnBright,Learn Bright,Climate Change for Kids | A fun engaging introduction to climate change for kids,776K,4 years,Hey Teachers and Parents! In this video we explore climate change for kids. We learn all about the causes of climate change like ...,2026-01-21 08:44:49.971672
/watch?v=_LwH6O4jaXY&pp=ygUOZ2xvYmFsIHdhcm1pbmc%3D,/@byjusclasses,BYJU'S,What Is Global Warming? | Class 7 - Geography | Learn With BYJU'S,720K,4 years,Climate change and global warming are taking a toll on Earth and its inhabitants. We know that humans are responsible for this.,2026-01-21 08:44:49.972958
/watch?v=8DiWzvE52ZY&list=RD8DiWzvE52ZY&start_radio=1&pp=ygUOZ2xvYmFsIHdhcm1pbmegBwE%3D,/channel/UC34wpCgr3l9cG0RtFdTTS-Q,Gojira,Gojira - Global Warming [Live at the Silver Cord Studio May 2018],9.5M,7 years,"A few weeks ago, we played Global Warming together for the first time since the recording of From Mars To Sirius (2004).",2026-01-21 08:44:49.974255
/watch?v=sDS1sFg6lNw&pp=ygUOZ2xvYmFsIHdhcm1pbmc%3D,/@NDTV,NDTV,"Climate Change and Global Warming, EXPLAINED | The Climate Explainers",392K,2 years,"In this episode of The Climate Explainers, Anubha Bhonsle explains the difference between climate change & global warming, ...",2026-01-21 08:44:49.975533
/watch?v=pwvVephTIHU&pp=ygUOZ2xvYmFsIHdhcm1pbmc%3D,/@bostonglobe,The Boston Globe,Global warming:  why you should not worry,962K,15 years,(Boston Globe) An MIT scientist explains the potential dangers SUBSCRIBE TO OUR CHANNEL FOR MORE VIDEOS.,2026-01-21 08:45:00.383423
/watch?v=WxPqrmDwVdU&pp=ygUOZ2xvYmFsIHdhcm1pbmc%3D,/@NakedScience,Naked Science,Earth on Fire? How BRUTAL Is Global Warming?,7.7K,3 weeks,"We explore the urgent effects of climate change on our environment, from rising temperatures and extreme weather to melting ice ...",2026-01-21 08:45:00.384860
/shorts/adWMjnuD2NU,/@KyanaSue,Kyana Sue Powers,"Global warming is not political, it’s science 🥵 #iceland #globalwarming #climatechange",167K,8 months,Ice caves melt away every year and new ones form but the glacier is melting at speeds much faster than they used to. We are ...,2026-01-21 08:45:00.386207
/watch?v=C-gdabZooKo&pp=ygUOZ2xvYmFsIHdhcm1pbmc%3D,/@ProfessorDaveExplains,Professor Dave Explains,Matt Ridley is Lying to You About Climate Change,314K,4 months,Go to https://consensus.app/ for a new way to search through primary scientific literature! It's finally time to tackle climate change ...,2026-01-21 08:45:00.387598
/watch?v=IJoAcD0oUww&pp=ygUOZ2xvYmFsIHdhcm1pbmc%3D,/@SmileandLearnEnglish,Smile and Learn - English,Climate Change - The environment for Kids (Updated Version),545K,5 years,"Educational video for children to learn what climate change is, what can we do to stop it and take better care of our planet.",2026-01-21 08:45:00.390462
/shorts/IZPt4WHwHCI,/@Amritadrawingbook,Amrita Drawing Book ,Global Warming Drawing Easy #amritadrawingbook #shorts #globalwarming,297K,2 years,Global Warming Drawing Easy #amritadrawingbook #shorts #globalwarming #drawing #howtodraw #easydrawing #poster ...,2026-01-21 08:45:00.392512
/watch?v=Mqzs5VSjObE&pp=ygUOZ2xvYmFsIHdhcm1pbmc%3D,/@StarTalk,StarTalk,The Link Between Milankovitch Cycles & Climate Change,830K,5 months,Go to https://ground.news/startalk to stay fully informed on the latest Space and Science news. Save 40% off through our link for ...,2026-01-21 08:45:00.395286
/watch?v=ECYMHIbBYyI&pp=ygUOZ2xvYmFsIHdhcm1pbmc%3D,/@pbsterra,PBS Terra,We Just Crossed Our FIRST Tipping Point… And It’s NOT What You Think,720K,2 months,Check out our Patreon: ...,2026-01-21 08:45:00.397127
/watch?v=OWXoRSIxyIU&pp=ygUOZ2xvYmFsIHdhcm1pbmc%3D,/@veritasium,Veritasium,13 Misconceptions About Global Warming,5.9M,11 years,Donate to the IPCC to prevent climate change → https://ve42.co/donateIPCC Common misconceptions about climate change.,2026-01-21 08:45:00.401185
/shorts/Ekw3nBuqbf0,/@NasDaily,Nas Daily,How I Touched Climate Change #486,4.5M,2 years,"I saw icebergs breaking and melting - with my own eyes! When you see it, you can finally believe it. This is it for Greenland. I hope ...",2026-01-21 08:45:00.402810
/watch?v=7kKd8MpEkVk&pp=ygUOZ2xvYmFsIHdhcm1pbmc%3D,/@memeabledata,Memeable Data,What 3 Degrees of Global Warming Looks Like,198K,4 months,"Thank you Odoo for sponsoring this video: https://www.odoo.com/r/jeV ABOUT THIS VIDEO: List of sources, music, 3D model ...",2026-01-21 08:45:00.404448
/watch?v=EtW2rrLHs08&pp=ygUOZ2xvYmFsIHdhcm1pbmc%3D,/@NatGeo,National Geographic,Climate Change 101 with Bill Nye | National Geographic,3.2M,10 years,"Climate Change is a real and serious issue. In this video Bill Nye, the Science Guy, explains what causes climate change, how it ...",2026-01-21 08:45:00.407418
/watch?v=KnjaQU8069A&pp=ygUOZ2xvYmFsIHdhcm1pbmc%3D,/@SimonClark,Simon Clark,The genius point Trump made about climate change,479K,3 months,A stopped clock is still right twice a day. Kinda? Get yourself a Nebula subscription: https://go.nebula.tv/simonclark My video with ...,2026-01-21 08:45:00.409053
/watch?v=xnQEFTv75xg&pp=ygUOZ2xvYmFsIHdhcm1pbmc%3D,/@get.factual,Get.factual,Antarctica’s Alarming Changes: New Discoveries & Climate Crisis | Full Documentary,245K,11 months,"This award-winning documentary reveals scientific revelations and threatening climate change effects, like penguin suicide, new ...",2026-01-21 08:45:00.411008
/watch?v=cn9PhiDJp-A&list=RDcn9PhiDJp-A&start_radio=1&pp=ygUOZ2xvYmFsIHdhcm1pbmegBwE%3D,/@Hopscotchsongs,Hopscotch,Climate Change Song,7.8M,4 years,A song that helps kids understand global warming and what we all need to do about it today. Subscribe!,2026-01-21 08:45:00.416087
/shorts/a8bhWauGlHU,/@_TinyTots,Tiny Tots,10 lines On Global Warming| Essay On Global Warming | #shorts #globalwarming,35K,7 months,10 lines On Global Warming| Essay On Global Warming | Global Warming Essay in English | Global Warming Essay writing ...,2026-01-21 08:45:00.417393
/watch?v=J1KGnCj_cfM&pp=ygUOZ2xvYmFsIHdhcm1pbmc%3D,/@SabineHossenfelder,Sabine Hossenfelder,How do we know climate change is caused by humans?,642K,1 year,Expand your scientific horizon on Brilliant! ➜ First 200 to use our link https://brilliant.org/sabine will get 20% off the annual ...,2026-01-21 08:45:00.420771
/watch?v=EhAemz1v7dQ&pp=ygUOZ2xvYmFsIHdhcm1pbmc%3D,/@kurzgesagt,Kurzgesagt – In a Nutshell,Do we Need Nuclear Energy to Stop Climate Change?,9.5M,4 years,Get Merch designed with ❤ from https://kgs.link/shop-140 Join the Patreon Bird Army https://kgs.link/patreon ▽▽ More infos ...,2026-01-21 08:45:00.423871
/shorts/MdpP_lymCyM,/@PlanetExpressTV-s1,Planet Express TV,"""The Crazy Plan to Fix Global Warming""",2.4M,4 months,Futurama #PhilipJFry #Leela #Bender #ProfessorFarnsworth #Zoidberg #AmyWong #HermesConrad #Nibbler #PlanetExpress ...,2026-01-21 08:45:00.425148
/shorts/I7ZpVhyHtLU,/@PKRnotes,PKR Notes for Students ,Global Warming / Solutions to prevent global warming /,5.7K,7 months,Solutions to prevent global warming / #globalwarming.,2026-01-21 08:45:00.428631
/watch?v=SN5-DnOHQmE&pp=ygUOZ2xvYmFsIHdhcm1pbmc%3D,/@NASASpacePlace,NASA Space Place,What Is the Greenhouse Effect?,3.2M,5 years,Earth is a comfortable place for living things. It's just the right temperatures for plants and animals – including humans – to thrive.,2026-01-21 08:45:10.681618
/shorts/GnMx7jn281E,/@nytimes,The New York Times,We’ve Breached a Key Limit for Global Warming. Now What?,10K,1 year,"Global temperatures last year crept past 1.5 degrees Celsius, a key marker for climate diplomacy, raising questions about how ...",2026-01-21 08:45:10.682951
/shorts/c2r7Igmpvns,/@Classmatelive,Classmate live,🌍 Global Warming Essay in English ✍️ | Easy & Short Paragraph for Students #shorts,51K,7 months,Learn how to write a short and simple essay on Global Warming in neat handwriting. Perfect for school students and handwriting ...,2026-01-21 08:45:10.685782
/shorts/TVJ_5gUcrwU,/@GeoGlobeTales,GeoGlobeTales,If All the Ice on Earth Melts 🧊 Global Flood Map 🌍,6.4M,8 months,#whatif #meltingice #climatechange #globalwarming #sealevel #earthwarming #climate #glaciermelt #antarctica #greenland ...,2026-01-21 08:45:10.687385
/shorts/bbtVP9SkyZE,/@nakulsahuart,Nakul Sahu Art,Global Warming Project | Main Causes of Global Warming Explained with working Model | #shortsfeed,117K,6 months,"🌍 Global Warming Science Project Nakul sahu art

In this video, I showcase my school science project on Global Warming. The ...",2026-01-21 08:45:10.688699
/shorts/laphFdXr9aY,/@ThinkCreativeMakeCreative,Think Creative Make Creative,How to Make Global Warming Model For School Projects Step by Step #diy #craft,160K,2 years,"Hello friends, here I show you How to Make Global Warming model. Please see carefully and make it easily. It will help the ...",2026-01-21 08:45:10.692215
/watch?v=7hu6vDP2a4Q&pp=ygUOZ2xvYmFsIHdhcm1pbmc%3D,/@Freesciencelessons,Freesciencelessons,"GCSE Biology Revision ""Global Warming""",210K,7 years,Learn smarter with PLUS. Try for free: https://www.freesciencelessons.co.uk/modules/gcse-biology-1-triple/ If you're a teacher and ...,2026-01-21 08:45:10.694094
/watch?v=nBBKSpLUQcg&pp=ygUOZ2xvYmFsIHdhcm1pbmc%3D,/@NHKWORLDJAPAN,NHK WORLD-JAPAN,"Asia's ""Double Global Warming"" - IMPACTS: Climates Change the World",18K,2 months,Learn more about climate change on NHK WORLD-JAPAN: ...,2026-01-21 08:45:10.695248
/shorts/PJ0FfmuCQPo,/@KajuClasses,Kaju Classes,Global Warming essay in english/10 lines on Global Warming/Few lines about Global Warming,69K,8 months,Global Warming essay in english/10 lines on Global Warming/Few lines about Global Warming Your queries: 10 Lines Essay on ...,2026-01-21 08:45:10.697016
/watch?v=TkRmrPQDPFw&t=388s&pp=ygUOZ2xvYmFsIHdhcm1pbmc%3D,/@BBCWorldService,BBC World Service,Why the world's superpowers are racing to control the Arctic - BBC World Service,2M,3 months,04:29 Russia and China's partnership 06:28 How climate change is affecting shipping routes 07:47 What resources are there in ...,2026-01-21 08:45:10.700437
/shorts/I-fJGMRpNEA,/@WeatherWest,Weather West,"Why 1.5°C is a ""geologically significant"" level of global warming",3.2K,1 year,Climate scientist Daniel Swain ( @WeatherWest ) discusses why 1.5°C of #globalwarming is so immensely consequential for ...,2026-01-21 08:45:10.701908
/watch?v=oYhCQv5tNsQ&pp=ygUOZ2xvYmFsIHdhcm1pbmc%3D,/@WisdomLand,Wisdom Land,The Great Global Warming Swindle - Full Documentary HD,1.4M,7 years,"The Great Global Warming Swindle caused controversy in the UK when it premiered March 8, 2007 on British Channel 4.",2026-01-21 08:45:10.703015
/watch?v=ezci9Sv1GzQ&pp=ygUOZ2xvYmFsIHdhcm1pbmc%3D,/@Factsforkids,Hey! Guess What,What is GLOBAL WARMING?  Facts for Kids,87K,2 years,"What is GLOBAL WARMING? Facts for Kids In this video, we're going to learn about global warming, and discover why it's such an ...",2026-01-21 08:45:10.705242
/shorts/Tj3Reukh_7s,/@im_siowei,im_siowei,How To Stop Global Warming,2.5M,2 years,YAEY.,2026-01-21 08:45:10.706471
/shorts/4tuMSDCYSas,/@Kansalcreation,Kansal Creation,Global warming school project/Model of Global warming #globalwarming #viralshort,25K,6 months,viralshort #Globalwarmingschoolproject #schoolprojectforexhibition.,2026-01-21 08:45:10.709750
/watch?v=57x_SWsv6QU&pp=ygUOZ2xvYmFsIHdhcm1pbmc%3D,/@FrancisCrickInstitute,The Francis Crick Institute,Will We Survive Climate Change? – A Question of Science with Brian Cox,109K,3 months,Professor Brian Cox and a panel of experts discuss how to curb rising global temperatures and what life could be like in a warmer ...,2026-01-21 08:45:10.711415
/watch?v=5UsKzOkOn-c&pp=ygUOZ2xvYmFsIHdhcm1pbmfSBwkJhwoBhyohjO8%3D,/@SabineHossenfelder,Sabine Hossenfelder,"“Termination Shock” Could Explain Recent Global Warming, Some Climate Scientists Think",255K,3 months,Want to restore the planet's ecosystems and see your impact in monthly videos? The first 100 people to join Planet Wild with my ...,2026-01-21 08:45:10.713153
/watch?v=fsah3Z2pC6Q&pp=ygUOZ2xvYmFsIHdhcm1pbmc%3D,/@SimonClark,Simon Clark,2025: climate tipping point or turning point?,94K,2 weeks,Start 2026 with a daily learning habit using my link https://www.brilliant.org/simonclark for a FREE 30 DAY TRIAL and a 20% ...,2026-01-21 08:45:10.714482
